PLACE_NM,GUGUN_NM,TRRSRT_LA,TRRSRT_LO,TRRSRT_ROAD_NM_ADDR,TEL_NO,GRP_NM,SEASON_NM,IEM_NM,CL_NM,ETC_CN
부산영화체험박물관,중구,35.10169,129.0337,부산광역시 중구 대청로126번길 12,0517154200,"가족,아이,커플,친구,혼자",사계절,"문화,체험",도시,"영화의 도시 부산에 ‘봄’이 왔다. 봄(BOM)은 Busan museum Of Movies의 줄임말로 영화의 모든 것을 보고, 느끼고, 즐기는 영화관련 전문체험관이다. 매년 부산국제영화제가 개최되고 영화촬영지로서 최적의 조건을 갖춘 도시 부산에, 영화제작에 관련된 다양한 체험콘텐츠를 즐길 수 있는 공간이 생긴 것이다."
브라운핸즈 백제,동구,35.11635,129.03696,부산광역시 동구 중앙대로209번길 16,0514640332,"커플,친구,혼자",사계절,"자연,걷기,이색여행","산,도시","이바구길에서 처음으로 마주친 스폿은 바로 브라운핸즈 백제, 심야카페 장편의 배경이 되는 장소이기도 하다. 1927년 개업한 백제병원 건물이 지금은 보수와 개조를 거쳐 브라운핸즈 백제라는 이름의 근사한 카페가 됐다. 등록문화재 제647호로 지정되어 건물 외관은 물론 내부 바닥 등을 최대한 보존했기 때문에 과거의 흔적을 만나볼 수 있는 곳이다. 현대 건축미와 레트로한 감성이 동시에 느껴지는 건물 입구 앞에 서서 사진을 찍는 것만으로도 예쁜 추억을 만들기엔 충분하다."
이바구캠프,동구,35.119048,129.02643,부산광역시 동구 망양로533번길 30-8,0514670289,"커플,친구,혼자",사계절,"자연,걷기,이색여행","산,도시","잠시 동안 버스를 타고 이동해서 도착한 곳은 이바구캠프. 드라마에 등장했는데 산복도로의 꼭대기에 위치하고 있어서 전망이 좋기로도 유명하다. 그냥 지나치기 아쉬운 전망이라 여행자들이 잠시 쉬어 갈 수 있도록 도시민박촌을 조성했는데, 전망 좋은 게스트하우스와 옥상 캠프는 SNS에서는 이미 유명한 뷰 맛집이다."
네모상점,연제구,35.19148,129.09218,부산광역시 연제구 신금로 25 2층 227호,050713879640,"가족,부모,아이,커플,친구,혼자",사계절,"체험,이색여행",도시,"둥근 지구를 위한 네모의 실천’이라는 캐치프레이즈와 함께 아기자기~ 소유욕 발동하는 예쁜 친환경 제품을 판매하는 네모상점! 이곳에서는 탈색, 색소 등 어떠한 약품처리도 하지 않은 천연 수세미를 비롯해 패브릭 컵홀더 등 여행과 일상생활에서 사용할 수 있는 다양한 제품을 판매하고 있다. 네모상점에서 강력히 추천하는 제품은 바로 비누처럼 만든 주방 세제. 화학 성분과 화학 계면활성제가 첨가되지 않은 식물유래 성분으로 만들어 더욱더 안심하고 사용할 수 있다. 이것이야말로 화학물질에 노출된 현대인에게 딱 필요한 제로 웨이스트 물품이지 않을까 싶다. 네모상점에서는 재활용품에 또 다른 디자인과 활용도를 더해 가치를 높이는 업사이클링 체험도 할 수 있다."
심플리파이,수영구,35.14231,129.10808,부산광역시 수영구 남천동로16번길 5,0516280622,"가족,부모,아이,커플,친구,혼자",사계절,"체험,이색여행",도시,"쓰레기 없는 가게 심플리파이,심플리파이! 다소 작은 규모의 제로 웨이스트 숍이지만 주방용품, 욕실용품, 의류, 식기, 식품 등 없는 것 빼고 다 있는 속이 꽉 찬~ 가게다. 천연 리넨 소재 옷을 비롯해 에코백, 손수건, 유기농 순면 생리대 등 다양한 제품을 갖추고 있어 여성들의 발길이 잦은 곳!"
천연제작소,북구,35.21084,129.00835,부산광역시 북구 덕천1길 93 2층,0513389619,"가족,부모,아이,커플,친구,혼자",사계절,"체험,이색여행",도시,"부산 최초의 제로 웨이스트 숍으로 유명한 천연제작소! 명성답게 각종 다양한 제품이 섹션 별로 나누어져 있다. 그래서 필요한 물품을 찾기에도 수월하다. 제로 웨이스트 실천 중 가장 쉽게, 가장 먼저 할 수 있는 것을 꼽으라면 그것은 바로 ‘칫솔 교체’! 칫솔에서 떨어져 나오는 미세 플라스틱의 문제가 대두되면서 옥수수 전분, 나무 등으로 만든 칫솔이 주목받고 있다. 천연제작소에는 칫솔을 비롯한 다양한 욕실용품과 주방용품, 생활용품 등을 판매하고 있다."
스카이라인루지,기장군,35.19464,129.21669,부산 부산광역시 기장군 기장읍 시랑리 산60-1,0517226002,"가족,부모,아이,커플,친구",사계절,"자연,체험,이색여행",도시,"유유자적, 모든 게 천천히 흘러가는 듯 여유가 느껴지는 이 가을을 좀 더 박진감 있게 타는 방법이 있다. 그것은 바로 ‘스카이라인 루지.’ 32년 전 뉴질랜드에서 처음 시작한 스카이라인 루지는 누구라도 쉬운 조작법으로 모든 연령대가 즐길 수 있는 액티비티다."
화명생태공원,북구,35.22594,129.00342,부산광역시 북구 화명동 1718-17,0513106057,"가족,부모,아이,커플,친구",사계절,"자연,체험,이색여행",도시,봄이면 수수한 벚꽃이 흐드러지게 피고 가을이면 빨간 단풍이 매력을 뽐내는 화명생태공원! 요리보고 조리 봐도 울창한 나무와 숲이 있는 이곳은 상쾌한 공기를 마시며 라이딩 하기에 딱 좋은 장소다. 씽씽- 페달을 밟고 가을바람을 가로지르며 달리다 보면 ‘센티함이 뭐예요?’라는 생각이 절로 든다.
고우니생태길,사하구,35.04825,128.96046,부산광역시 사하구 다대동 다대로 다대포 생태탐방로,0512205891,"아이,커플,친구,혼자",사계절,"걷기,이색여행",기타,"다대포해수욕장을 따라 줍깅을 하다 보면 이내 고우니생태길에 도착한다. 데크 길을 걸으며 다대포해수욕장의 풍광을 바라볼 수 있을 뿐 아니라 습지와 갈대가 어우러져 사진찍기 좋아 연인들의 데이트 코스로 주목받고 있는 이곳! 특히, 주말이면 셀프스냅 촬영을 위해 방문한 연인들의 모습을 심심찮게 발견할 수 있다. 사람들의 발길이 잦은 곳인 만큼 줍깅하기 좋은 장소. 무엇보다, 노을에 물든 갈대가 바람에 살랑이는 로맨틱한 풍경을 보면 흘린 땀이 절대 아깝지 않을 것이다."
흰여울터널,영도구,35.07589,129.04594,부산광역시 영도구 영선동4가 1210-38,0514194067,"가족,부모,아이,커플,친구,혼자",가을,"자연,공원,이색여행",바다,감천문화마을 만큼이나 이국적인 풍경을 자랑하는 부산여행지가 바로 영도 흰여울문화마을이다. 발 아래로 바다가 펼쳐지는 해안 절벽에 위치한 마을이라 그리스 산토리니도 부럽지 않은 경치를 자랑한다. 커다란 외항선들이 마을 앞바다에 정박해 있는 모습을 보고 있으면 외국의 어느 섬에 와 있는 듯한 착각마저 든다. 항구도시 부산의 매력을 이토록 진하게 느낄 수 있는 공간이 또 있을까.
역사의 디오라마,중구,35.1037756,129.00762,부산광역시 중구 영주로 93,0519995729,혼자,사계절,걷기,도시,"부산의 역사를 압축해 보여주는 공간으로 산복도로만 한 곳도 없다. 경사지를 따라 빼곡히 들어선 가옥은 마치 피난민의 남루했던 삶과 부두노동자의 고단했던 하루가 빚어낸 하나의 예술작품 같아 보인다. 1960년대 중반 이 달동네를 가로지르는 도로가 만들어지는데, 사람들은 굽이치는 가파른 길 위를 달리는 버스 위에 몸을 싣고 학교로, 일터로 향했다. 점점 번듯한 집들이 들어서고 그렇게 동네는 변화를 맞는다. 민주공원으로 올라가는 길 중턱에 있는 ‘역사의 디오라마(Diorama)’는 이런 부산의 과거를 미적으로 풀어낸 공간이다. 이곳에는 관조, 남고(覽古), 응시, 전망 등 4가지 테마로 구성된 건축물이 들어서 있다. 거기엔 부산의 자연과 문화 그리고 근대역사를 관통해 미래로 가고자 하는 뜻이 담겨 있다. 그 의지는 발치 아래 펼쳐진 푸른 바다 조망과 어우러지며 완성된다. 역사의 디오라마에서 이어진 길을 따라 오르면 민주공원에 이른다. 산꼭대기 작은 조각공원 주변으로 사람들이 삼삼오오 모여 있다. 장기, 바둑으로 여가를 보내는 장면이다."
삼락상설카약체험장,사상구,35.16907,128.96745,부산광역시 사상구 삼락동 29-21 삼락수상레포츠타운(삼락오토캠핑장 옆),07041400006,"아이,커플,친구,혼자",여름,"자연,체험,이색여행",바다,"카약을 타기 전, 안전을 위한 기본방법은 숙지해야겠죠? 구명조끼 착용법을 배우고 나면 전문 강사님께서 카약 타는 방법을 친절하게 가르쳐 주신답니다. 사실 카약 타는 것이 그리 어렵지 않아서 초보도 걱정 없이 바로 탈 수 있습니다. 카약에 처음 앉을 때는 마음이 굉장히 설레고 조금 긴장이 되기도 해요. 강사님이 큰 소리로 카운트다운 하신 후에 온 힘을 다해서 카약을 강물에다 밀어 넣어버리죠. 그 몇 초의 순간은 정말이지 짜릿짜릿 하답니다. 물에 막 들어갔을 땐 배 위에서 방향을 익히는 것에 약간의 시간이 걸릴 수도 있어요. 하지만 왼쪽 오른쪽 노를 저어가다 보면 원하는 방향으로 손쉽게 조절이 가능하다는 것을 알게 되죠. 카약탈 때의 가장 큰 재미는 자기 스스로 속도와 방향을 제어할 수 있다는 것 아니겠습니까? 흐르는 강물 따라 유유자적을 하든, 속도를 붙여 열심히 앞을 향해 나아가든, 그 모든 걸 컨트롤 할 수 있는 사람은 바로 나 자신이라는 거죠"
UN기념공원,남구,35.1279,129.09399,부산광역시 남구 유엔평화로 93,0516250625,커플,가을,이색여행,"바다,산","화창한 날씨가 계속되는 요즘, 대연동에 있는 UN기념공원으로 가볍게 가을 산책을 떠나보자. UN기념공원은 한국전쟁 중 전사한 UN군을 기리기 위한 세계 유일의 UN군 묘지이자 성지다. 하지만 부산 사람들이 유독 가을만 되면 이곳을 찾는 이유는 따로 있다. 바로 울긋불긋 가을로 물들어 가는 메타세쿼이아 가로수 길을 보기 위해서다."
감지해변,영도구,35.05987,129.06876,부산광역시 영도구 동삼동,0514058745,"커플,친구,혼자",사계절,걷기,"바다,산",태종사에서 내려오면 태종대 일주도로와 만난다. 오른쪽으로 가면 곧장 태종대 유원지 입구로 향하고 왼쪽으로 가면 영도등대와 전망대를 거쳐 유원지 입구로 갈 수 있다. 시간이 넉넉하다면 왼쪽으로 방향을 잡고 걸으면서 중간에 만나는 영도등대와 전망대를 함께 둘러보자. 유네스코 지질공원으로 지정될 만큼 아름다운 태종대의 해안 풍경을 만날 수 있는 코스다.
태종사,영도구,35.05592,129.08596,부산광역시 영도구 전망로 119,0514037775,"커플,친구,혼자",사계절,걷기,"바다,산",드라마틱했던 태종대 비밀의 숲의 대미를 장식할 태종사는 1970년대에 세워진 사찰이다. 대웅전을 중심으로 산신각과 그 외 부속 건물들이 태종산 자락에 자리하고 있는데 고즈넉한 분위기가 주변 풍경과 잘 어우러진다.
동래읍성탐방로,동래구,35.21006,129.08799,부산광역시 동래구 안락동,0515504081,혼자,사계절,"자연,걷기,이색여행",산,"치욕의 역사 임진왜란, 그 전쟁이 시작됐던 부산. 동래사적공원은 이런 역사를 더듬어 볼 수 있는 장소다. 400여 년 전 죽음의 냄새 진동하던 성터는 평화로운 시민들의 안식처가 된지 오래다. 길의 시작은 동래읍성 ‘인생문(人生門)’ 부터다. 재미있는 이름이다. 전해져 내려오는 이야기에 따르면 임진왜란 당시 현재 인생문이 있던 고개를 지나 피난 간 사람은 모두 목숨을 건졌다고 한다. 문 위에 올라 길을 따라 가면 곧장 나무가 우거진 숲길을 지난다. 야트막한 언덕을 오르다 보면 피라미드를 연상시키는 높다란 조형물을 만난다. 바로 부산 3·1운동기념탑이다. 이 탑은 광복 50주년인 1995년 8월 15일에 착공해 1996년 3월 1일에 완공됐다. 임진왜란의 쓰라진 패배 현장 그리고 거기 덧쓰인 독립운동, 가만히 3·1운동기념탑을 둘러보자 역사가 줄곧 전하고자 하는 메시지가 어렴풋하게나마 느껴지는 것만 같다. 이어진 길을 따라 가면 과거 장수들의 지위소로 쓰였던 북장대가 지척이다. 동래읍성 내에서 가장 경치가 좋은 장소다. 북장대 성곽 너머로 장산~황령산~금정봉으로 이어지는 부산의 스카이라인이 한눈에 들어온다. 탁 트인 조망을 감상하고 시간이 켜켜이 내려앉은 성곽을 따라 내려서면 동래읍성에서 유일하게 과거 모습 그대로 남아 있는 북문에 이른다. 거기서 완만하게 고개를 드는 언덕을 따라 오르면 한옥의 아름다움을 고스란히 간직한 서장대에 닿는다. 그렇다고 걷기가 끝난 건 아니다. 동래사적공원 주변으로는 동래부동헌, 동래읍성역사관, 장영실과학동산, 북천동고분군, 동래향교, 충렬사 등 다양한 볼거리가 가득하다. 어디로 발길을 돌릴지 잠시 망설여진다."
아미산전망대,사하구,35.05277,128.95857,부산광역시 사하구 다대낙조2길 77,0512656863,"아이,커플,친구,혼자",사계절,"걷기,이색여행",기타,"노을을 보며 줍깅할 수 있는 코스 중 마지막 장소는 바로 아미산전망대! 고우니생태길에서 도보로 약 20분 정도밖에 걸리지 않기에 충분히 걸어갈 수 있다. 한 폭의 풍경화처럼 아름다운 낙동강의 일몰을 볼 수 있는 이곳에서는 진우도, 대마등, 장자도, 신자도 등을 한눈에 조망할 수 있다."
신호공원,강서구,35.08078,128.87252,부산광역시 강서구 신호산단1로72번길 46,0519746524,"가족,부모,아이,커플,친구","봄,여름,가을","자연,체험,이색여행",바다,"‘어디에 돗자리를 펼까?’란 고민은 하지 않아도 될 만큼 어디에 펴도 가을의 정취를 누릴 수 있을 것이다. 이곳에서의 취사는 불가능하지만 간단한 도시락 등은 가능! 여행의 묘미는 뭐니 뭐니 해도 직접 손으로 준비한 수제 도시락이 아닐까? 연인과 함께 오면 더 좋은 이곳에서 맛있는 음식도 나눠 보고 로맨스도 느껴보기를... 가족들은 함께 배드민턴, 원반던지기 등 간단한 운동을 하기에도 딱 좋다."
소담공원,강서구,35.1785,129.16433,부산광역시 강서구 신호동 263,0519745745,"가족,부모,아이,커플,친구","봄,여름,가을","자연,체험,이색여행",바다,"‘어디에 돗자리를 펼까?’란 고민은 하지 않아도 될 만큼 어디에 펴도 가을의 정취를 누릴 수 있을 것이다. 이곳에서의 취사는 불가능하지만 간단한 도시락 등은 가능! 여행의 묘미는 뭐니 뭐니 해도 직접 손으로 준비한 수제 도시락이 아닐까? 연인과 함께 오면 더 좋은 이곳에서 맛있는 음식도 나눠 보고 로맨스도 느껴보기를... 가족들은 함께 배드민턴, 원반던지기 등 간단한 운동을 하기에도 딱 좋다."
부산현대미술관,사하구,35.10928,128.94056,부산 사하구 낙동남로 1191,0512207400,"가족,부모,아이,커플,친구,혼자","봄,여름,가을","자연,공원",바다,"선화와 도영이 일 때문에 재회하며 밤길을 걷는 곳은 소박하고 따뜻한 풍경이 일품인 남치이 인문학거리다. 이곳은 부산 수영구 남천성당 뒤, 숨겨진 이색 거리로 남천1동의 대표적인 특화거리다. 나무들 사이 소박하게 난 오솔길 곳곳에는 익숙한 시가 적힌 팻말이 있어 문학의 향기를 맡으며 사색할 수 있다."
광안리 민락항 방파제,수영구,35.1094,128.87271,부산광역시 수영구 민락동 광안해변로,0516104744,"가족,부모,아이,커플,친구,혼자","봄,여름,가을","자연,공원",바다,"민락항을 안고 있는 빨간 등대와 하얀 등대는 민락항 방파제의 백미! 노출되어있는 철제 사다리는 다소 밋밋할 수 있는 등대에 멋을 더하고 듬직하면서도 고풍스럽게 서 있는 등대는 민락항의 정취에 품격을 더한다. 수영만 주변을 병풍처럼 둘러싸고 있는 거대한 마천루를 한눈에 조망할 수 있는 민락항 방파제는 부산 걷기 명소로도 손꼽히는 곳이다. 특히, 해가 진 밤에 찾아가면 수많은 불빛이 신비로운 별빛처럼 흩뿌려진 절경을 감상할 수 있다."
이기대 몽돌해변,남구,35.13221,129.11881,부산광역시 남구 용호동 산25 이기대해안산책로 해변,0516076399,"아이,혼자",여름,자연,바다,장산봉 자락의 바위 절벽과 동해바다가 맞닿은 이기대. 군사작전지구로 일반인 출입이 통제됐었지만 1993년부터 일반에 개방되면서 누구나 이기대의 멋진 풍광을 만날 수 있다.?해안절벽을 따라 4.7km나 이어지는 트레킹 코스도 훌륭하지만 바다 너머로 보이는 해운대 마린시티의 고층 빌딩들은 이기대를 더욱 특별하게 만드는 풍경이다. 파도가 넘실대는 산책로를 따라 뚜벅뚜벅 걷다 보면 마음이 개운해지는 신비로운 장소기도 하다.?
몰운대 몽돌해변,사하구,35.13233,129.05096,부산광역시 사하구 다대동 산144,0512204082,"아이,혼자",여름,자연,바다,"다대포해수욕장 왼쪽 끝 지점에서 바다 쪽으로 길에 튀어나온 야트막한 산이 하나 있다. 몰운대다. 해류의 영향으로 안개와 구름이 많은 곳인데 이 때문에 섬이 잘 보이지 않는다고 하여 몰운대(沒雲臺)라는 이름을 갖게 됐다고 한다.?몰운대 입구의 가파른 언덕을 따라 조금만 올라가면 울창한 숲길이 나타난다. 평탄한 길을 10분 정도 걸으면 다대포객사가 보이고 여기에서 왼쪽으로 내려가면 곧장 해변으로 이어진다.?가운데에 길을 두고 왼쪽 해변은 모래마당, 오른쪽 해변은 자갈마당이다. 해안을 따라 제법 길게 이어지는 모래마당과 달리 자갈마당은 바위틈에 파묻힌 형국이다. 그리 넓지 않은 공간이지만 납작하고 둥근 몽돌이 해변에 가득하다.?"
천마산전망대,서구,35.08916,129.01455,부산광역시 서구 남부민동 산 4-35,0512404532,"가족,부모,아이,커플,친구,혼자",사계절,이색여행,"바다,산,도시","도심 속 잠시 스쳤을 싱그러운 풀내음이 내내 코끝에 머무는 숲길은 천마산전망대로 향하는 길이다. 힘들지 않은 평탄한 산책로를 걸으면 이내 탁 트인 원도심뷰를 볼 수 있는 천마산전망대가 나온다. 이곳에서는 부산항과 영도다리를 품고 있는 하늘 풍경을 감상할 수 있다. 빽빽하게 들어선 건물은 바다와 산과 어우러져 전혀 답답해 보이지 않는다. 또, 밤만큼이나 눈부시다."
이바구충전소,동구,35.11735,129.0325,부산광역시 동구 영초윗길 25,0514404063,"가족,아이,친구,혼자",사계절,"체험,이색여행",도시,"명란파스타를 만들 수 있는 명란셀프쿠킹 클래스가 진행되고 있습니다. 부산여행특공대 홈페이지에서 초량명란로드 관련 투어 내용을 확인할 수 있습니다. 명란셀프쿠킹을 위한 재료와 조리도구는 미리 준비되어 있으니, 선생님의 요리법을 열심히 따라가기만 하면 된답니다. 이바구충전소 2층에서 시식도 직접 할 수 있습니다. 옛 가옥의 형태를 그대로 유지한 2층의 공간은 아담하면서도 독특한 분위기를 자아냅니다. 프라이버시를 존중해주는 공간 분할도 아주 훌륭합니다. 파스타를 돌돌 말아 입안에 넣으니, 명란의 탱탱한 식감과 신선함에 한층 기분이 좋아집니다."
부산그린레일웨이,해운대구,35.16123,129.19136,부산광역시 해운대구 달맞이길62번길 13(해운대블루라인파크 미포정거장),0517015548,"가족,부모,아이,커플,친구,혼자",사계절,"체험,걷기,이색여행",바다,"오늘의 힐링 산책코스는 미포 블루라인 파크에서 시작합니다. 해운대 해변열차의 미포정거장이 있는 곳이기도 한데요, 평탄한 산책로에 들어서면 시선을 사로잡는 조형물과 주변 경관이 기분을 좋게 합니다. 미포에서 송정까지의 긴 구간이 모두 나무데크로 조성된 산책로로 이어져 있습니다. 나무계단이 해안절벽을 따라 이어져 있는 곳도 있어 바다를 한층 가까이에서 만날 수 있어요. 전망대에서 만나는 해운대의 풍경은 또 다른 장관을 선사합니다. 회백색 달맞이 터널은 알록달록 색깔옷을 입었습니다. 무지개색 다채로운 외벽을 배경으로 예쁜 추억 많이 남기세요~^^"
배산숲길,연제구,35.18016,129.09602,부산광역시 연제구 연산동,0516786303,"가족,부모,아이,커플,친구,혼자",사계절,"자연,걷기",산,"산이 많은 부산에서 주변이 온통 주택가로 둘러싸인 배산은 조금 높은 동네언덕 정도로 생각하면 될 것 같아요. 배산 둘레길을 완주하는데 넉넉잡아 1시간이면 충분할 정도니까요. 동네분들의 데일리 트레킹 코스이기도 하거니와 높이가 낮은 덕에 남녀노소 누구나 부담 없이 도전해 볼 만한 산입니다. 경사도가 있는 구간을 선택하려면 도시철도 3호선 배산역에서 연산배수지 방향으로 오르는 코스를, 조금 완만하게 시작하고 싶다면 연산동 고분군에서 시작하는 코스를 선택하면 좋을 것 같아요. 물론 이 두 코스 외에도 배산 주위 등산로는 아주 다양합니다. 어느 곳에서든 바로 숲길 트레킹을 시작할 수 있어요."
성북고개,동구,35.13837,129.04579,부산 동구 좌천동,0514404814,"가족,아이,커플,친구",사계절,"걷기,이색여행","산,도시","낮에 걷는 길과는 전혀 다른 모습을 보여줄 것을 알기에 기대와 설렘이 다가옵니다. 산허리를 가로질러 조성된 산복도로, 부산만의 특징이 가득한 길을 걷습니다. 눈 아래 펼쳐지는 부산 도심의 전경도 구경하고, 골목골목 이어진 계단도 오르내리고, 초록이 우거진 숲길도 걸어봅니다. 산복도로 골목마다 켜켜이 쌓인 동구 주민들의 소박한 일상을 만날 수 있는 길이랍니다."
금수사,동구,35.15806,128.98772,부산광역시 동구 초량6동 망양로 533-1,0514673316,"가족,아이,커플,친구",사계절,"걷기,이색여행","산,도시","부산항이 한눈에 내려다보이는 금수사(金水寺)는 옛날부터 수행의 자리였다고 전한다. 임진왜란이 끝나고 1604년(선조 37) 조선인 포로들의 귀환을 협상하기 위해 승려 사명(四溟)[1544~1610]이 일본에 가게 되었다. 그때 사명 대사가 구계산에서 하루를 머물었는데, 이곳의 물맛을 맛보고 주위를 둘러보고는 실로 수도할 만한 자리라고 감탄하였다. 이때 사명을 따르던 한 제자가 그로부터 얼마 뒤 초암을 짓고 수행하였다. 그 이후 자세한 이야기는 전하지 않는다."
영진어묵카페,동구,35.1176,129.00009,부산광역시 동구 초량동 영초윗길 22-1,0514620055,"가족,아이,커플,친구",사계절,"걷기,이색여행","산,도시",이 곳은 삼성전기(주) 부산사업장 임직원들의 따뜻한 사랑과 아름다운 나눔으로 만들어진 공간으로 부산의 자랑인 영진어묵을 팔고 있으며 넓은 공간에서 내려다보는 부산의 전경이 시원한 곳이다.
금정산성,금정구,35.2755,129.05531,부산광역시 금정구 금성동,0515194082,"가족,부모,아이,커플,친구,혼자",사계절,걷기,"바다,산","부산에서 가장 아름다운 경치를 자랑하는 금정산을 방문해 보는 건 어떨까요? 여러 갈래의 등산로가 있어 오르고 싶은 코스를 골라 등산할 수도 있지만 금강공원에서 출발하는 케이블카를 타고 좀 더 편안하게 정상 부근까지 오르는 방법도 있답니다. 금강공원 내 평탄한 오솔길은 산책을 부르는 아름다운 길입니다. 풍성한 수목의 상쾌한 향기를 즐기며 곧 케이블카 승강장에 도착하게 되지요. 케이블카에서 내려 소나무 숲 사이로 난 길을 따라가면 금정산성 남문, 동문, 산성마을까지 이어집니다. 조선시대에 금정산성을 드나드는 성문이었던 곳은 세월의 흔적을 고스란히 간직하고 있어요. 자연석으로 쌓아 올린 성벽은 삐뚤빼뚤 돌의 모양이 제각각이지만 그만큼 켜켜이 쌓인 정교한 시간을 말해주는 듯합니다."
